{
  "schemaVersion" : "matching.m12.topology.v1",
  "status" : "PASS",
  "implementation" : "REAL_AERON_CHILD_PROCESSES",
  "clusterId" : 12,
  "memberCount" : 3,
  "quorumSize" : 2,
  "aeronAppointedLeaderId" : -1,
  "automaticLeaderElection" : true,
  "initialLeaderIsRuntimeObservation" : true,
  "contractCorrection" : {
    "schemaVersion" : "matching.m12.contract-correction.v1",
    "status" : "PASS",
    "frozenWorkloadSha256" : "20ed1e75cd3cd86dc15a7f1f64465524a5638757abe676eb51f20bc5423b89a1",
    "frozenField" : "realClusterProfile.appointedInitialLeaderId",
    "frozenAppointedInitialLeaderId" : 0,
    "frozenAppointmentCompatibleWithThreeMemberHa" : false,
    "effectiveAeronAppointedLeaderId" : -1,
    "automaticElection" : true,
    "initialLeaderSelection" : "OBSERVED_AUTOMATIC_ELECTION",
    "initialLeaderId" : 1,
    "reason" : "Aeron appointedLeaderId disables automatic election and prevents the required Leader failover."
  },
  "localhostOnly" : true,
  "memberProcessStarts" : 6,
  "externalForceStops" : 3,
  "teardownComplete" : true,
  "childProcessesAliveAfterTeardown" : 0,
  "ownerProcessId" : 35884,
  "childClasspathStrategy" : "INHERITED_JAVA_CLASS_PATH",
  "archiveMarkFileLivenessTimeoutMillis" : 10000,
  "restartSafetyPredicate" : "ARCHIVE_MARK_FILE_ACTIVITY_AGE_GT_LIVENESS_TIMEOUT",
  "restartSafetyReason" : "A forced-stopped member is restarted only after a live ArchiveMarkFile activity-timestamp read observes age strictly greater than the dependency-pinned liveness timeout.",
  "restartSafetyWitnessCount" : 3,
  "restartSafetyWitnesses" : [ {
    "ordinal" : 1,
    "memberId" : 1,
    "stoppedProcessId" : 36323,
    "archiveMarkFile" : "/Users/reln/Documents/Codex/2026-09-07/ji/work/cex-m13-release-check-2/build/tmp/m12/three-member-failover/node-1/archive/archive-mark.dat",
    "lastActivityTimestampMillis" : 1788767619583,
    "observedAtMillis" : 1788767629584,
    "ageMillis" : 10001,
    "livenessTimeoutMillis" : 10000,
    "probeCount" : 3023,
    "waitElapsedNanos" : 3749191667,
    "aeronVersion" : "1.52.2",
    "predicate" : "ARCHIVE_MARK_FILE_ACTIVITY_AGE_GT_LIVENESS_TIMEOUT",
    "activityTimestampPositive" : true,
    "ageStrictlyExceedsLivenessTimeout" : true
  }, {
    "ordinal" : 2,
    "memberId" : 0,
    "stoppedProcessId" : 36322,
    "archiveMarkFile" : "/Users/reln/Documents/Codex/2026-09-07/ji/work/cex-m13-release-check-2/build/tmp/m12/three-member-failover/node-0/archive/archive-mark.dat",
    "lastActivityTimestampMillis" : 1788767629584,
    "observedAtMillis" : 1788767639585,
    "ageMillis" : 10001,
    "livenessTimeoutMillis" : 10000,
    "probeCount" : 3279,
    "waitElapsedNanos" : 4105098208,
    "aeronVersion" : "1.52.2",
    "predicate" : "ARCHIVE_MARK_FILE_ACTIVITY_AGE_GT_LIVENESS_TIMEOUT",
    "activityTimestampPositive" : true,
    "ageStrictlyExceedsLivenessTimeout" : true
  }, {
    "ordinal" : 3,
    "memberId" : 1,
    "stoppedProcessId" : 36338,
    "archiveMarkFile" : "/Users/reln/Documents/Codex/2026-09-07/ji/work/cex-m13-release-check-2/build/tmp/m12/three-member-failover/node-1/archive/archive-mark.dat",
    "lastActivityTimestampMillis" : 1788767629845,
    "observedAtMillis" : 1788767643366,
    "ageMillis" : 13521,
    "livenessTimeoutMillis" : 10000,
    "probeCount" : 1,
    "waitElapsedNanos" : 187125,
    "aeronVersion" : "1.52.2",
    "predicate" : "ARCHIVE_MARK_FILE_ACTIVITY_AGE_GT_LIVENESS_TIMEOUT",
    "activityTimestampPositive" : true,
    "ageStrictlyExceedsLivenessTimeout" : true
  } ],
  "statusFreshnessClock" : "MONOTONIC_STATUS_SEQUENCE_ADVANCE",
  "wallClockUsedForStatusAcceptance" : false,
  "stableSnapshotWitnessCount" : 9,
  "stableSnapshotWitnesses" : [ {
    "ordinal" : 1,
    "condition" : "one authoritative M12 Leader",
    "statusPublishIntervalMillis" : 100,
    "freshnessBoundMillis" : 1000,
    "elapsedNanos" : 109098000,
    "allMemberStatusSequencesAdvanced" : true,
    "monotonicElapsedWithinFreshnessBound" : true,
    "firstSnapshot" : [ {
      "memberId" : 0,
      "processId" : 36322,
      "statusSequence" : 4,
      "observedAtEpochMillis" : 1788767619002,
      "role" : "FOLLOWER",
      "electionState" : "CLOSED",
      "leadershipTermId" : 0,
      "commitPosition" : 96,
      "logPosition" : 96,
      "nextApplicationSequence" : 1,
      "identityCount" : 0,
      "semanticStateDigest" : "0f9403eba94a22f36c02809f42c0066a330f53f2416494b06b45641d1f809690",
      "identityResultDigest" : "df3f619804a92fdb4057192dc43dd748ea778adc52bc498ce80524c014b81119",
      "componentErrorCount" : 0,
      "diagnosticWarningCount" : 0,
      "droppedDiagnosticWarnings" : 0,
      "diagnosticWarnings" : [ ]
    }, {
      "memberId" : 1,
      "processId" : 36323,
      "statusSequence" : 4,
      "observedAtEpochMillis" : 1788767619028,
      "role" : "LEADER",
      "electionState" : "CLOSED",
      "leadershipTermId" : 0,
      "commitPosition" : 96,
      "logPosition" : 96,
      "nextApplicationSequence" : 1,
      "identityCount" : 0,
      "semanticStateDigest" : "0f9403eba94a22f36c02809f42c0066a330f53f2416494b06b45641d1f809690",
      "identityResultDigest" : "df3f619804a92fdb4057192dc43dd748ea778adc52bc498ce80524c014b81119",
      "componentErrorCount" : 0,
      "diagnosticWarningCount" : 0,
      "droppedDiagnosticWarnings" : 0,
      "diagnosticWarnings" : [ ]
    }, {
      "memberId" : 2,
      "processId" : 36324,
      "statusSequence" : 4,
      "observedAtEpochMillis" : 1788767619037,
      "role" : "FOLLOWER",
      "electionState" : "CLOSED",
      "leadershipTermId" : 0,
      "commitPosition" : 96,
      "logPosition" : 96,
      "nextApplicationSequence" : 1,
      "identityCount" : 0,
      "semanticStateDigest" : "0f9403eba94a22f36c02809f42c0066a330f53f2416494b06b45641d1f809690",
      "identityResultDigest" : "df3f619804a92fdb4057192dc43dd748ea778adc52bc498ce80524c014b81119",
      "componentErrorCount" : 0,
      "diagnosticWarningCount" : 0,
      "droppedDiagnosticWarnings" : 0,
      "diagnosticWarnings" : [ ]
    } ],
    "secondSnapshot" : [ {
      "memberId" : 0,
      "processId" : 36322,
      "statusSequence" : 5,
      "observedAtEpochMillis" : 1788767619109,
      "role" : "FOLLOWER",
      "electionState" : "CLOSED",
      "leadershipTermId" : 0,
      "commitPosition" : 96,
      "logPosition" : 96,
      "nextApplicationSequence" : 1,
      "identityCount" : 0,
      "semanticStateDigest" : "0f9403eba94a22f36c02809f42c0066a330f53f2416494b06b45641d1f809690",
      "identityResultDigest" : "df3f619804a92fdb4057192dc43dd748ea778adc52bc498ce80524c014b81119",
      "componentErrorCount" : 0,
      "diagnosticWarningCount" : 0,
      "droppedDiagnosticWarnings" : 0,
      "diagnosticWarnings" : [ ]
    }, {
      "memberId" : 1,
      "processId" : 36323,
      "statusSequence" : 5,
      "observedAtEpochMillis" : 1788767619131,
      "role" : "LEADER",
      "electionState" : "CLOSED",
      "leadershipTermId" : 0,
      "commitPosition" : 96,
      "logPosition" : 96,
      "nextApplicationSequence" : 1,
      "identityCount" : 0,
      "semanticStateDigest" : "0f9403eba94a22f36c02809f42c0066a330f53f2416494b06b45641d1f809690",
      "identityResultDigest" : "df3f619804a92fdb4057192dc43dd748ea778adc52bc498ce80524c014b81119",
      "componentErrorCount" : 0,
      "diagnosticWarningCount" : 0,
      "droppedDiagnosticWarnings" : 0,
      "diagnosticWarnings" : [ ]
    }, {
      "memberId" : 2,
      "processId" : 36324,
      "statusSequence" : 5,
      "observedAtEpochMillis" : 1788767619145,
      "role" : "FOLLOWER",
      "electionState" : "CLOSED",
      "leadershipTermId" : 0,
      "commitPosition" : 96,
      "logPosition" : 96,
      "nextApplicationSequence" : 1,
      "identityCount" : 0,
      "semanticStateDigest" : "0f9403eba94a22f36c02809f42c0066a330f53f2416494b06b45641d1f809690",
      "identityResultDigest" : "df3f619804a92fdb4057192dc43dd748ea778adc52bc498ce80524c014b81119",
      "componentErrorCount" : 0,
      "diagnosticWarningCount" : 0,
      "droppedDiagnosticWarnings" : 0,
      "diagnosticWarnings" : [ ]
    } ]
  }, {
    "ordinal" : 2,
    "condition" : "member business-state convergence",
    "statusPublishIntervalMillis" : 100,
    "freshnessBoundMillis" : 1000,
    "elapsedNanos" : 109089708,
    "allMemberStatusSequencesAdvanced" : true,
    "monotonicElapsedWithinFreshnessBound" : true,
    "firstSnapshot" : [ {
      "memberId" : 0,
      "processId" : 36322,
      "statusSequence" : 12,
      "observedAtEpochMillis" : 1788767619869,
      "role" : "FOLLOWER",
      "electionState" : "CLOSED",
      "leadershipTermId" : 0,
      "commitPosition" : 12064,
      "logPosition" : 12064,
      "nextApplicationSequence" : 34,
      "identityCount" : 33,
      "semanticStateDigest" : "4bf623fec98933e47de2b8f9a1c88c6c17584a78bbf03a0b056240b0e84eefea",
      "identityResultDigest" : "1a2a9e355edf836a2e3475bfef0b335fcc47e9572e7eb2bbf76ccb044dfc3d52",
      "componentErrorCount" : 0,
      "diagnosticWarningCount" : 0,
      "droppedDiagnosticWarnings" : 0,
      "diagnosticWarnings" : [ ]
    }, {
      "memberId" : 1,
      "processId" : 36323,
      "statusSequence" : 11,
      "observedAtEpochMillis" : 1788767619777,
      "role" : "LEADER",
      "electionState" : "CLOSED",
      "leadershipTermId" : 0,
      "commitPosition" : 12064,
      "logPosition" : 12064,
      "nextApplicationSequence" : 34,
      "identityCount" : 33,
      "semanticStateDigest" : "4bf623fec98933e47de2b8f9a1c88c6c17584a78bbf03a0b056240b0e84eefea",
      "identityResultDigest" : "1a2a9e355edf836a2e3475bfef0b335fcc47e9572e7eb2bbf76ccb044dfc3d52",
      "componentErrorCount" : 0,
      "diagnosticWarningCount" : 0,
      "droppedDiagnosticWarnings" : 0,
      "diagnosticWarnings" : [ ]
    }, {
      "memberId" : 2,
      "processId" : 36324,
      "statusSequence" : 11,
      "observedAtEpochMillis" : 1788767619790,
      "role" : "FOLLOWER",